{
  "$schema": "http://json-schema.org/draft-07/schema#",
  "$id": "https://ai-native-slides.local/deck-spec.schema.json",
  "title": "Deck Spec",
  "type": "object",
  "additionalProperties": false,
  "required": [
    "spec_version",
    "generated_at",
    "project_slug",
    "source_prompt",
    "target_slide_count",
    "slides",
    "asset_manifest",
    "slide_mapping",
    "status"
  ],
  "properties": {
    "spec_version": {
      "type": "string",
      "minLength": 1
    },
    "generated_at": {
      "type": "string",
      "pattern": "^\\d{4}-\\d{2}-\\d{2}T\\d{2}:\\d{2}:\\d{2}(?:Z|[+-]\\d{2}:?\\d{2})$"
    },
    "project_slug": {
      "type": "string",
      "pattern": "^[a-z0-9]+(?:-[a-z0-9]+)*$"
    },
    "source_prompt": {
      "type": "string",
      "minLength": 1
    },
    "target_slide_count": {
      "type": "integer",
      "minimum": 1
    },
    "slides": {
      "type": "array",
      "minItems": 1,
      "items": {
        "$ref": "#/definitions/SlidePlan"
      }
    },
    "asset_manifest": {
      "$ref": "#/definitions/AssetManifest"
    },
    "slide_mapping": {
      "type": "array",
      "minItems": 1,
      "items": {
        "$ref": "#/definitions/SlideMapping"
      }
    },
    "status": {
      "enum": [
        "planned",
        "validated",
        "reviewed",
        "media_ready"
      ]
    }
  },
  "definitions": {
    "NonEmptyString": {
      "type": "string",
      "minLength": 1
    },
    "SnakeCaseId": {
      "type": "string",
      "pattern": "^[a-z0-9]+(?:_[a-z0-9]+)*$"
    },
    "StringArray": {
      "type": "array",
      "items": {
        "$ref": "#/definitions/NonEmptyString"
      }
    },
    "ImagePromptSpec": {
      "type": "object",
      "additionalProperties": false,
      "required": [
        "composition",
        "color_direction",
        "detail_cues",
        "avoid_elements"
      ],
      "properties": {
        "composition": {
          "$ref": "#/definitions/NonEmptyString"
        },
        "color_direction": {
          "$ref": "#/definitions/NonEmptyString"
        },
        "detail_cues": {
          "type": "array",
          "minItems": 1,
          "items": {
            "$ref": "#/definitions/NonEmptyString"
          }
        },
        "avoid_elements": {
          "$ref": "#/definitions/StringArray"
        }
      }
    },
    "PlainTextAsset": {
      "type": "object",
      "additionalProperties": false,
      "required": [
        "asset_id",
        "asset_label",
        "text_kind",
        "content",
        "required",
        "status"
      ],
      "properties": {
        "asset_id": {
          "$ref": "#/definitions/SnakeCaseId"
        },
        "asset_label": {
          "$ref": "#/definitions/NonEmptyString"
        },
        "text_kind": {
          "const": "plain_text"
        },
        "content": {
          "$ref": "#/definitions/NonEmptyString"
        },
        "required": {
          "type": "boolean"
        },
        "status": {
          "enum": [
            "planned",
            "placed",
            "validated"
          ]
        }
      }
    },
    "BulletListAsset": {
      "type": "object",
      "additionalProperties": false,
      "required": [
        "asset_id",
        "asset_label",
        "text_kind",
        "content",
        "required",
        "status"
      ],
      "properties": {
        "asset_id": {
          "$ref": "#/definitions/SnakeCaseId"
        },
        "asset_label": {
          "$ref": "#/definitions/NonEmptyString"
        },
        "text_kind": {
          "const": "bullet_list"
        },
        "content": {
          "type": "array",
          "minItems": 1,
          "items": {
            "$ref": "#/definitions/NonEmptyString"
          }
        },
        "required": {
          "type": "boolean"
        },
        "status": {
          "enum": [
            "planned",
            "placed",
            "validated"
          ]
        }
      }
    },
    "TextAsset": {
      "oneOf": [
        {
          "$ref": "#/definitions/PlainTextAsset"
        },
        {
          "$ref": "#/definitions/BulletListAsset"
        }
      ]
    },
    "SlideScopedImageAsset": {
      "type": "object",
      "additionalProperties": false,
      "required": [
        "asset_id",
        "asset_label",
        "slide_id",
        "intended_usage",
        "size_tier",
        "style",
        "subject",
        "aspect_ratio",
        "image_prompt_spec",
        "output_format",
        "required",
        "output_file_name",
        "status"
      ],
      "properties": {
        "asset_id": {
          "$ref": "#/definitions/SnakeCaseId"
        },
        "asset_label": {
          "$ref": "#/definitions/NonEmptyString"
        },
        "slide_id": {
          "$ref": "#/definitions/SnakeCaseId"
        },
        "intended_usage": {
          "enum": [
            "hero_visual",
            "supporting_visual",
            "background",
            "diagram",
            "icon",
            "cutout"
          ]
        },
        "size_tier": {
          "enum": [
            "small",
            "medium",
            "large"
          ]
        },
        "style": {
          "$ref": "#/definitions/NonEmptyString"
        },
        "subject": {
          "$ref": "#/definitions/NonEmptyString"
        },
        "aspect_ratio": {
          "enum": [
            "1:1",
            "4:3",
            "3:2",
            "16:9",
            "16:10",
            "9:16"
          ]
        },
        "image_prompt_spec": {
          "$ref": "#/definitions/ImagePromptSpec"
        },
        "output_format": {
          "enum": [
            "jpg",
            "png"
          ]
        },
        "required": {
          "type": "boolean"
        },
        "output_file_name": {
          "type": "string",
          "pattern": "^[a-z0-9_]+\\.(?:jpg|png)$"
        },
        "status": {
          "enum": [
            "planned",
            "generated",
            "placed",
            "validated"
          ]
        }
      }
    },
    "SharedVisualAsset": {
      "type": "object",
      "additionalProperties": false,
      "required": [
        "asset_id",
        "asset_label",
        "shared_scope",
        "intended_usage",
        "size_tier",
        "style",
        "subject",
        "aspect_ratio",
        "image_prompt_spec",
        "output_format",
        "required",
        "output_file_name",
        "status"
      ],
      "properties": {
        "asset_id": {
          "$ref": "#/definitions/SnakeCaseId"
        },
        "asset_label": {
          "$ref": "#/definitions/NonEmptyString"
        },
        "shared_scope": {
          "const": "deck"
        },
        "intended_usage": {
          "enum": [
            "hero_visual",
            "supporting_visual",
            "background",
            "diagram",
            "icon",
            "cutout"
          ]
        },
        "size_tier": {
          "enum": [
            "small",
            "medium",
            "large"
          ]
        },
        "style": {
          "$ref": "#/definitions/NonEmptyString"
        },
        "subject": {
          "$ref": "#/definitions/NonEmptyString"
        },
        "aspect_ratio": {
          "enum": [
            "1:1",
            "4:3",
            "3:2",
            "16:9",
            "16:10",
            "9:16"
          ]
        },
        "image_prompt_spec": {
          "$ref": "#/definitions/ImagePromptSpec"
        },
        "output_format": {
          "enum": [
            "jpg",
            "png"
          ]
        },
        "required": {
          "type": "boolean"
        },
        "output_file_name": {
          "type": "string",
          "pattern": "^[a-z0-9_]+\\.(?:jpg|png)$"
        },
        "status": {
          "enum": [
            "planned",
            "generated",
            "placed",
            "validated"
          ]
        }
      }
    },
    "AssetManifest": {
      "type": "object",
      "additionalProperties": false,
      "required": [
        "text_assets",
        "image_assets",
        "shared_assets"
      ],
      "properties": {
        "text_assets": {
          "type": "array",
          "items": {
            "$ref": "#/definitions/TextAsset"
          }
        },
        "image_assets": {
          "type": "array",
          "items": {
            "$ref": "#/definitions/SlideScopedImageAsset"
          }
        },
        "shared_assets": {
          "type": "array",
          "items": {
            "$ref": "#/definitions/SharedVisualAsset"
          }
        }
      }
    },
    "TextBlock": {
      "type": "object",
      "additionalProperties": false,
      "required": [
        "block_id",
        "block_type",
        "layout_slot",
        "text_asset_id"
      ],
      "properties": {
        "block_id": {
          "$ref": "#/definitions/SnakeCaseId"
        },
        "block_type": {
          "const": "text"
        },
        "layout_slot": {
          "$ref": "#/definitions/SnakeCaseId"
        },
        "text_asset_id": {
          "$ref": "#/definitions/SnakeCaseId"
        }
      }
    },
    "BulletListBlock": {
      "type": "object",
      "additionalProperties": false,
      "required": [
        "block_id",
        "block_type",
        "layout_slot",
        "text_asset_id"
      ],
      "properties": {
        "block_id": {
          "$ref": "#/definitions/SnakeCaseId"
        },
        "block_type": {
          "const": "bullet_list"
        },
        "layout_slot": {
          "$ref": "#/definitions/SnakeCaseId"
        },
        "text_asset_id": {
          "$ref": "#/definitions/SnakeCaseId"
        }
      }
    },
    "BadgeBlock": {
      "type": "object",
      "additionalProperties": false,
      "required": [
        "block_id",
        "block_type",
        "layout_slot",
        "text_asset_id"
      ],
      "properties": {
        "block_id": {
          "$ref": "#/definitions/SnakeCaseId"
        },
        "block_type": {
          "const": "badge"
        },
        "layout_slot": {
          "$ref": "#/definitions/SnakeCaseId"
        },
        "text_asset_id": {
          "$ref": "#/definitions/SnakeCaseId"
        }
      }
    },
    "CalloutBlock": {
      "type": "object",
      "additionalProperties": false,
      "required": [
        "block_id",
        "block_type",
        "layout_slot",
        "text_asset_id"
      ],
      "properties": {
        "block_id": {
          "$ref": "#/definitions/SnakeCaseId"
        },
        "block_type": {
          "const": "callout"
        },
        "layout_slot": {
          "$ref": "#/definitions/SnakeCaseId"
        },
        "text_asset_id": {
          "$ref": "#/definitions/SnakeCaseId"
        }
      }
    },
    "CardBlock": {
      "type": "object",
      "additionalProperties": false,
      "required": [
        "block_id",
        "block_type",
        "layout_slot",
        "title_asset_id",
        "body_asset_id"
      ],
      "properties": {
        "block_id": {
          "$ref": "#/definitions/SnakeCaseId"
        },
        "block_type": {
          "const": "card"
        },
        "layout_slot": {
          "$ref": "#/definitions/SnakeCaseId"
        },
        "title_asset_id": {
          "$ref": "#/definitions/SnakeCaseId"
        },
        "body_asset_id": {
          "$ref": "#/definitions/SnakeCaseId"
        },
        "accent_token": {
          "$ref": "#/definitions/SnakeCaseId"
        }
      }
    },
    "MetricBlock": {
      "type": "object",
      "additionalProperties": false,
      "required": [
        "block_id",
        "block_type",
        "layout_slot",
        "value_asset_id",
        "label_asset_id"
      ],
      "properties": {
        "block_id": {
          "$ref": "#/definitions/SnakeCaseId"
        },
        "block_type": {
          "const": "metric"
        },
        "layout_slot": {
          "$ref": "#/definitions/SnakeCaseId"
        },
        "value_asset_id": {
          "$ref": "#/definitions/SnakeCaseId"
        },
        "label_asset_id": {
          "$ref": "#/definitions/SnakeCaseId"
        },
        "accent_token": {
          "$ref": "#/definitions/SnakeCaseId"
        }
      }
    },
    "ImageSlideAssetBlock": {
      "type": "object",
      "additionalProperties": false,
      "required": [
        "block_id",
        "block_type",
        "layout_slot",
        "image_asset_id"
      ],
      "properties": {
        "block_id": {
          "$ref": "#/definitions/SnakeCaseId"
        },
        "block_type": {
          "const": "image"
        },
        "layout_slot": {
          "$ref": "#/definitions/SnakeCaseId"
        },
        "image_asset_id": {
          "$ref": "#/definitions/SnakeCaseId"
        }
      }
    },
    "ImageSharedAssetBlock": {
      "type": "object",
      "additionalProperties": false,
      "required": [
        "block_id",
        "block_type",
        "layout_slot",
        "shared_asset_id"
      ],
      "properties": {
        "block_id": {
          "$ref": "#/definitions/SnakeCaseId"
        },
        "block_type": {
          "const": "image"
        },
        "layout_slot": {
          "$ref": "#/definitions/SnakeCaseId"
        },
        "shared_asset_id": {
          "$ref": "#/definitions/SnakeCaseId"
        }
      }
    },
    "ContentBlock": {
      "oneOf": [
        {
          "$ref": "#/definitions/TextBlock"
        },
        {
          "$ref": "#/definitions/BulletListBlock"
        },
        {
          "$ref": "#/definitions/BadgeBlock"
        },
        {
          "$ref": "#/definitions/CalloutBlock"
        },
        {
          "$ref": "#/definitions/CardBlock"
        },
        {
          "$ref": "#/definitions/MetricBlock"
        },
        {
          "$ref": "#/definitions/ImageSlideAssetBlock"
        },
        {
          "$ref": "#/definitions/ImageSharedAssetBlock"
        }
      ]
    },
    "SlidePlan": {
      "type": "object",
      "additionalProperties": false,
      "required": [
        "slide_id",
        "title",
        "objectives",
        "layout_intent",
        "content_blocks",
        "status"
      ],
      "properties": {
        "slide_id": {
          "$ref": "#/definitions/SnakeCaseId"
        },
        "title": {
          "$ref": "#/definitions/NonEmptyString"
        },
        "objectives": {
          "type": "array",
          "minItems": 1,
          "items": {
            "$ref": "#/definitions/NonEmptyString"
          }
        },
        "layout_intent": {
          "enum": [
            "hero",
            "split_visual",
            "cards",
            "metrics",
            "timeline",
            "closing"
          ]
        },
        "content_blocks": {
          "type": "array",
          "minItems": 1,
          "items": {
            "$ref": "#/definitions/ContentBlock"
          }
        },
        "status": {
          "enum": [
            "planned",
            "validated"
          ]
        }
      }
    },
    "SlideMapping": {
      "type": "object",
      "additionalProperties": false,
      "required": [
        "slide_id",
        "text_asset_ids",
        "image_asset_ids",
        "shared_asset_ids"
      ],
      "properties": {
        "slide_id": {
          "$ref": "#/definitions/SnakeCaseId"
        },
        "text_asset_ids": {
          "type": "array",
          "items": {
            "$ref": "#/definitions/SnakeCaseId"
          }
        },
        "image_asset_ids": {
          "type": "array",
          "items": {
            "$ref": "#/definitions/SnakeCaseId"
          }
        },
        "shared_asset_ids": {
          "type": "array",
          "items": {
            "$ref": "#/definitions/SnakeCaseId"
          }
        }
      }
    }
  }
}
