{
  "spec_version": "1.0.0",
  "generated_at": "2026-03-14T01:34:00-07:00",
  "project_slug": "ai-native-product-deck",
  "source_prompt": "Create a contract-first product deck that explains canonical spec promotion, semantic review, media generation, and deterministic build-time rendering.",
  "target_slide_count": 6,
  "slides": [
    {
      "slide_id": "overview_hero",
      "title": "Contract-First Planning",
      "objectives": [
        "Show that planning becomes a canonical project input.",
        "Anchor visual generation and PPT composition to deterministic asset identities."
      ],
      "layout_intent": "hero",
      "content_blocks": [
        {
          "block_id": "hero_badge_block",
          "block_type": "badge",
          "layout_slot": "eyebrow_badge",
          "text_asset_id": "hero_badge"
        },
        {
          "block_id": "hero_message_block",
          "block_type": "text",
          "layout_slot": "hero_message",
          "text_asset_id": "hero_message"
        },
        {
          "block_id": "hero_visual_block",
          "block_type": "image",
          "layout_slot": "hero_visual",
          "image_asset_id": "hero_visual_asset"
        }
      ],
      "status": "validated"
    },
    {
      "slide_id": "semantic_review",
      "title": "Review Before Generation",
      "objectives": [
        "Keep semantic review separate from structural validation.",
        "Block media generation when the spec drifts from the source prompt."
      ],
      "layout_intent": "split_visual",
      "content_blocks": [
        {
          "block_id": "review_badge_block",
          "block_type": "badge",
          "layout_slot": "eyebrow_badge",
          "text_asset_id": "review_badge"
        },
        {
          "block_id": "review_message_block",
          "block_type": "bullet_list",
          "layout_slot": "split_message",
          "text_asset_id": "review_message_bullets"
        },
        {
          "block_id": "review_visual_block",
          "block_type": "image",
          "layout_slot": "split_visual",
          "image_asset_id": "review_visual_asset"
        },
        {
          "block_id": "review_callout_block",
          "block_type": "callout",
          "layout_slot": "split_callout",
          "text_asset_id": "review_callout"
        }
      ],
      "status": "validated"
    },
    {
      "slide_id": "canonical_inputs",
      "title": "Canonical Inputs",
      "objectives": [
        "Keep text and visual assets in one manifest.",
        "Make naming, mapping, and validation explicit before generation continues."
      ],
      "layout_intent": "cards",
      "content_blocks": [
        {
          "block_id": "adoption_bullets_block",
          "block_type": "bullet_list",
          "layout_slot": "supporting_bullets",
          "text_asset_id": "adoption_bullets"
        },
        {
          "block_id": "contract_card_block",
          "block_type": "card",
          "layout_slot": "primary_card",
          "title_asset_id": "card_title_contract",
          "body_asset_id": "card_body_contract",
          "accent_token": "teal_accent"
        },
        {
          "block_id": "mapping_card_block",
          "block_type": "card",
          "layout_slot": "secondary_card",
          "title_asset_id": "card_title_mapping",
          "body_asset_id": "card_body_mapping",
          "accent_token": "deck_navy"
        },
        {
          "block_id": "filename_card_block",
          "block_type": "card",
          "layout_slot": "tertiary_card",
          "title_asset_id": "card_title_filename",
          "body_asset_id": "card_body_filename",
          "accent_token": "deck_amber"
        },
        {
          "block_id": "cards_review_callout_block",
          "block_type": "callout",
          "layout_slot": "review_callout",
          "text_asset_id": "cards_review_callout"
        },
        {
          "block_id": "background_grid_block",
          "block_type": "image",
          "layout_slot": "background_texture",
          "shared_asset_id": "shared_background_grid"
        }
      ],
      "status": "validated"
    },
    {
      "slide_id": "delivery_metrics",
      "title": "Validation Signals",
      "objectives": [
        "Show that the contract produces measurable workflow checkpoints.",
        "Keep required images and shared visuals indexable by slide."
      ],
      "layout_intent": "metrics",
      "content_blocks": [
        {
          "block_id": "metric_slides_block",
          "block_type": "metric",
          "layout_slot": "left_metric",
          "value_asset_id": "metric_value_slides",
          "label_asset_id": "metric_label_slides",
          "accent_token": "deck_teal"
        },
        {
          "block_id": "metric_assets_block",
          "block_type": "metric",
          "layout_slot": "center_metric",
          "value_asset_id": "metric_value_assets",
          "label_asset_id": "metric_label_assets",
          "accent_token": "deck_navy"
        },
        {
          "block_id": "metric_status_block",
          "block_type": "metric",
          "layout_slot": "right_metric",
          "value_asset_id": "metric_value_status",
          "label_asset_id": "metric_label_status",
          "accent_token": "deck_amber"
        },
        {
          "block_id": "audience_callout_block",
          "block_type": "text",
          "layout_slot": "supporting_text",
          "text_asset_id": "audience_callout"
        },
        {
          "block_id": "metrics_visual_block",
          "block_type": "image",
          "layout_slot": "supporting_visual",
          "image_asset_id": "metrics_support_visual"
        }
      ],
      "status": "validated"
    },
    {
      "slide_id": "operator_timeline",
      "title": "Operator Flow",
      "objectives": [
        "Make the operator path explicit from prompt interpretation to deck build.",
        "Show which stages mutate canonical artifacts and which only validate."
      ],
      "layout_intent": "timeline",
      "content_blocks": [
        {
          "block_id": "timeline_step_one_block",
          "block_type": "card",
          "layout_slot": "timeline_step_1",
          "title_asset_id": "timeline_step_1_title",
          "body_asset_id": "timeline_step_1_body",
          "accent_token": "deck_teal"
        },
        {
          "block_id": "timeline_step_two_block",
          "block_type": "card",
          "layout_slot": "timeline_step_2",
          "title_asset_id": "timeline_step_2_title",
          "body_asset_id": "timeline_step_2_body",
          "accent_token": "deck_navy"
        },
        {
          "block_id": "timeline_step_three_block",
          "block_type": "card",
          "layout_slot": "timeline_step_3",
          "title_asset_id": "timeline_step_3_title",
          "body_asset_id": "timeline_step_3_body",
          "accent_token": "deck_amber"
        },
        {
          "block_id": "timeline_step_four_block",
          "block_type": "card",
          "layout_slot": "timeline_step_4",
          "title_asset_id": "timeline_step_4_title",
          "body_asset_id": "timeline_step_4_body",
          "accent_token": "deck_coral"
        },
        {
          "block_id": "timeline_summary_block",
          "block_type": "callout",
          "layout_slot": "timeline_summary",
          "text_asset_id": "timeline_summary"
        }
      ],
      "status": "validated"
    },
    {
      "slide_id": "stable_build",
      "title": "Build From Stable Inputs",
      "objectives": [
        "Keep build deterministic and offline once canonical inputs exist.",
        "Make missing assets or invalid status transitions fail fast."
      ],
      "layout_intent": "closing",
      "content_blocks": [
        {
          "block_id": "closing_badge_block",
          "block_type": "badge",
          "layout_slot": "closing_badge",
          "text_asset_id": "closing_badge"
        },
        {
          "block_id": "closing_message_block",
          "block_type": "text",
          "layout_slot": "closing_message",
          "text_asset_id": "closing_message"
        },
        {
          "block_id": "closing_visual_block",
          "block_type": "image",
          "layout_slot": "closing_visual",
          "image_asset_id": "closing_visual_asset"
        },
        {
          "block_id": "closing_callout_block",
          "block_type": "callout",
          "layout_slot": "closing_callout",
          "text_asset_id": "closing_callout"
        }
      ],
      "status": "validated"
    }
  ],
  "asset_manifest": {
    "text_assets": [
      {
        "asset_id": "hero_badge",
        "asset_label": "Hero badge",
        "text_kind": "plain_text",
        "content": "CANONICAL INPUT",
        "required": true,
        "status": "validated"
      },
      {
        "asset_id": "hero_message",
        "asset_label": "Hero message",
        "text_kind": "plain_text",
        "content": "A buildable deck should start from one validated spec, one semantic review decision, and one stable asset manifest before any composition code runs.",
        "required": true,
        "status": "validated"
      },
      {
        "asset_id": "review_badge",
        "asset_label": "Review badge",
        "text_kind": "plain_text",
        "content": "SEMANTIC REVIEW",
        "required": true,
        "status": "validated"
      },
      {
        "asset_id": "review_message_bullets",
        "asset_label": "Review bullets",
        "text_kind": "bullet_list",
        "content": [
          "Keep prompt alignment checks separate from structural schema validation.",
          "Write the review result as an explicit artifact before any image step runs.",
          "Treat fail outcomes as a hard gate for downstream generation."
        ],
        "required": true,
        "status": "validated"
      },
      {
        "asset_id": "review_callout",